{
  "lockfileVersion": 1,
  "generatedAt": "2026-02-08T01:47:29.183Z",
  "generatedBy": "uhr@0.1.0",
  "platforms": [
    "claude-code",
    "cursor"
  ],
  "installed": {
    "teleportation-cli": {
      "version": "1.3.0",
      "installedAt": "2026-02-07T21:13:23.261Z",
      "integrity": "sha256-3f58cfcead7c",
      "source": "local:/tmp/teleportation-conflict.json",
      "hooks": [
        {
          "id": "sync-after-edit",
          "on": "afterToolExecution",
          "command": "teleport sync",
          "tools": [
            "write"
          ]
        }
      ],
      "requires": [],
      "conflicts": [
        "rival-sync"
      ]
    },
    "core-sync": {
      "version": "1.1.0",
      "installedAt": "2026-02-07T21:06:18.946Z",
      "integrity": "sha256-5f065ceaa3dd",
      "source": "local:/tmp/core-sync.v1.json",
      "hooks": [
        {
          "id": "sync",
          "on": "afterToolExecution",
          "command": "sync v2",
          "tools": [
            "write",
            "edit"
          ]
        }
      ],
      "requires": [],
      "conflicts": []
    },
    "rival-sync": {
      "version": "1.0.0",
      "installedAt": "2026-02-07T21:13:23.121Z",
      "integrity": "sha256-742897fc9c64",
      "source": "local:/tmp/rival-sync.json",
      "hooks": [
        {
          "id": "sync",
          "on": "afterToolExecution",
          "command": "rival sync",
          "tools": [
            "write"
          ]
        }
      ],
      "requires": [],
      "conflicts": []
    }
  },
  "resolvedOrder": {
    "afterToolExecution": [
      "core-sync/sync",
      "rival-sync/sync",
      "teleportation-cli/sync-after-edit"
    ]
  }
}
